Group,Sentence
3,Trees and mountains under a colorful sky.
2,Clearly divided sections of landscape and sky.
2,Orderly representation of colors and shapes.
3,Natural elements depicted clearly and colorfully.
3,"Clearly visible mountains, trees, and flowing river."
3,"Clear image of trees, river, and sky."
1,Reality gently dissolving into abstract landscapes.
1,Clouds and trees blending into a poetic abstraction.
1,Dreamlike visions emerge softly from radiant skies.
1,An endless river winding through dreams of vibrant color.
1,The landscape speaks quietly in colors and abstract rhythms.
2,Structured and clear arrangement of colorful elements.
3,A clear image of nature with vibrant colors.
2,Vibrant yet clearly organized representation of mountains and sky.
2,Clear depiction of natural elements with structured precision.
1,Unseen colors emerging gently from the canvas.
3,Simple and realistic landscape painted clearly.
2,The landscape is arranged clearly with defined colors and shapes.
1,Landscapes whispering dreams painted in imaginative tones.
2,"Balanced elements of sky, river, and mountains presented distinctly."
3,"Basic landscape featuring river, trees, and mountains."
3,"A colorful painting with mountains, trees, and clouds."
2,The landscape clearly emphasizes balance and structure.
1,"Colors merge into surreal forms, whispering poetic dreams."
3,"A painting of mountains, trees, and a river."
2,Clearly and systematically painted natural elements.
1,Skies and mountains melting softly into surreal visions.
1,A magical dance of colors upon an imaginary land.
3,Trees beside a river with mountains and a bright sky.
1,Mountains breathe softly beneath swirling pastel skies.
3,Natural elements depicted in bright colors.
2,Color gradients clearly organized in landscape elements.
1,Trees seem to dance silently in hues unseen before.
3,Simple depiction of colorful landscape and sky.
2,Well-defined forms and structures within the painting.
3,A colorful scene showing trees and clouds.
1,Ethereal forms rise gently within colorful dreams.
2,Geometric precision clearly observed in landscape features.
2,Carefully structured trees and river forming visual harmony.
3,A clear and literal depiction of natural scenery.
2,"Detailed composition with distinct trees, river, and clouds."
1,"Rivers flow into dream-like scenes, weaving colors fluidly."
1,Surreal landscapes painted from imaginative whispers.
2,"Structured, clear presentation of colors and landscape."
3,A straightforward painting of natural scenery.
